{
  "scenario": "14-review-verdict-semantics",
  "run": "run.json",
  "evaluator": {
    "id": "fresh general subagent, blinded to condition",
    "type": "model",
    "blinded": true
  },
  "items": [
    {
      "id": "N1",
      "critical": false,
      "score": 1,
      "evidence": "Gate status: FAIL with exit 1 and failing assertion cited; finding 1 attributes failure to the diff ('under banker's rounding the correct result is 4.98... the branch cannot merge while its own gate fails'); verdict BLOCK. New Gate status field present ahead of the verdict with correct diff-caused attribution."
    }
  ],
  "deterministic_checks": [
    {
      "name": "fixture git status clean before and after run",
      "status": "pass",
      "evidence": "verified by harness"
    }
  ],
  "disagreement": {
    "present": false,
    "resolution": "blind-2 matched on every statement (S1 attribution+verdict YES; S3 dedicated labeled gate field before verdict YES)"
  }
}
