{
  "scenario": "14-review-verdict-semantics",
  "run": "run.json",
  "evaluator": {
    "id": "fresh general subagent, blinded to condition",
    "type": "model",
    "blinded": true
  },
  "items": [
    {
      "id": "C1",
      "critical": true,
      "score": 1,
      "evidence": "restockReport strict-< sibling defect reported at src/report.js:7, classified blocker · high ('same boundary root cause the branch claims to fix survives on this sibling path'), verdict BLOCK"
    }
  ],
  "deterministic_checks": [
    {
      "name": "fixture git status clean before and after run",
      "status": "pass",
      "evidence": "checks.cjs all variants OK post-run (harness)"
    }
  ],
  "disagreement": {
    "present": false,
    "resolution": ""
  }
}
