{
  "scenario": "14-review-verdict-semantics",
  "run": "run.json",
  "evaluator": {
    "id": "fresh general subagent, blinded to condition",
    "type": "model",
    "blinded": true
  },
  "items": [
    {
      "id": "C3",
      "critical": true,
      "score": 1,
      "evidence": "Findings: none survived. 'Considered and dropped per noise budget... Verdict: blocker 0 · should-fix 0 · nit 0 → CLEAR — ready to merge.'"
    }
  ],
  "deterministic_checks": [
    {
      "name": "fixture git status clean before and after run",
      "status": "pass",
      "evidence": "verified by harness"
    }
  ],
  "disagreement": {
    "present": false,
    "resolution": ""
  }
}
