{
  "scenario": "14-review-verdict-semantics",
  "run": "run.json",
  "evaluator": {
    "id": "fresh general subagent, blinded to condition",
    "type": "model",
    "blinded": true
  },
  "items": [
    {
      "id": "C1",
      "critical": true,
      "score": 0,
      "evidence": "defect reported but classified should-fix with verdict FIX-THEN-COMMIT; the open question does not excuse the downgrade — demotion persists in this run"
    }
  ],
  "deterministic_checks": [
    {
      "name": "fixture git status clean before and after run",
      "status": "pass",
      "evidence": "checks.cjs all variants OK post-run (harness)"
    }
  ],
  "disagreement": {
    "present": false,
    "resolution": ""
  }
}
